product_name,product_price,product_rating,people_rated,product_imglink
"Running Fast Dry Shorts Mens Gym Fitness Sport Bermuda Jogging Training Shorts Summer Male Multi-Pocket Beach Sweatpants,Running Fast Dry Shorts Mens Gym Fitness Sport Bermuda Jogging Training Shorts Summer Male Multi-Pocket Beach Sweatpants,TXC- Summer Men's Shorts Cotton Loose Large Size Men's Casual Five-Point Pants Wear Men's Shorts Comfortable and Breathable (Color : Khaki, Size : 3XL),TXC- Summer Men's Shorts Cotton Loose Large Size Men's Casual Five-Point Pants Wear Men's Shorts Comfortable and Breathable (Color : Earth Yellow+Dark Blue, Size : 5XL),Running Fast Dry Shorts Mens Gym Fitness Sport Bermuda Jogging Training Shorts Summer Male Multi-Pocket Beach Sweatpants,TXC- Summer Men's Shorts Cotton Loose Large Size Men's Casual Five-Point Pants Wear Men's Shorts Comfortable and Breathable (Color : Army Green, Size : 5XL),TXC- Summer Men's Shorts Cotton Loose Large Size Men's Casual Five-Point Pants Wear Men's Shorts Comfortable and Breathable (Color : Khaki, Size : 4XL),TXC- Summer Men's Shorts Cotton Loose Large Size Men's Casual Five-Point Pants Wear Men's Shorts Comfortable and Breathable (Color : Army Green, Size : XL),TXC- Summer Men's Shorts Cotton Loose Large Size Men's Casual Five-Point Pants Wear Men's Shorts Comfortable and Breathable (Color : Black, Size : 4XL),Running Fast Dry Shorts Mens Gym Fitness Sport Bermuda Jogging Training Shorts Summer Male Multi-Pocket Beach Sweatpants,TXC- Summer Men's Shorts Cotton Loose Large Size Men's Casual Five-Point Pants Wear Men's Shorts Comfortable and Breathable (Color : Earth Yellow, Size : XL),TXC- Summer Men's Shorts Cotton Loose Large Size Men's Casual Five-Point Pants Wear Men's Shorts Comfortable and Breathable (Color : Khaki+Dark Blue, Size : 2XL),TXC- Summer Men's Shorts Cotton Loose Large Size Men's Casual Five-Point Pants Wear Men's Shorts Comfortable and Breathable (Color : Army Green, Size : 4XL),TXC- Summer Men's Shorts Cotton Loose Large Size Men's Casual Five-Point Pants Wear Men's Shorts Comfortable and Breathable (Color : Army Green+Black, Size : 5XL),TXC- Summer Men's Shorts Cotton Loose Large Size Men's Casual Five-Point Pants Wear Men's Shorts Comfortable and Breathable (Color : Light Gray+Black, Size : 2XL),Running Fast Dry Shorts Mens Gym Fitness Sport Bermuda Jogging Training Shorts Summer Male Multi-Pocket Beach Sweatpants,TXC- Summer Men's Shorts Cotton Loose Large Size Men's Casual Five-Point Pants Wear Men's Shorts Comfortable and Breathable (Color : Khaki+Dark Gray, Size : 4XL),TXC- Summer Men's Shorts Cotton Loose Large Size Men's Casual Five-Point Pants Wear Men's Shorts Comfortable and Breathable (Color : Black, Size : L),Running Fast Dry Shorts Mens Gym Fitness Sport Bermuda Jogging Training Shorts Summer Male Multi-Pocket Beach Sweatpants,TXC- Summer Men's Shorts Cotton Loose Large Size Men's Casual Five-Point Pants Wear Men's Shorts Comfortable and Breathable (Color : Light Gray, Size : 3XL),TXC- Summer Men's Shorts Cotton Loose Large Size Men's Casual Five-Point Pants Wear Men's Shorts Comfortable and Breathable (Color : Army Green, Size : 2X L),TXC- Summer Men's Shorts Cotton Loose Large Size Men's Casual Five-Point Pants Wear Men's Shorts Comfortable and Breathable (Color : Khaki+Dark Blue, Size : 2XL),TXC- Summer Men's Shorts Cotton Loose Large Size Men's Casual Five-Point Pants Wear Men's Shorts Comfortable and Breathable (Color : Khaki, Size : 3XL),TXC- Summer Men's Shorts Cotton Loose Large Size Men's Casual Five-Point Pants Wear Men's Shorts Comfortable and Breathable (Color : Khaki, Size : 5XL),TXC- Summer Men's Shorts Cotton Loose Large Size Men's Casual Five-Point Pants Wear Men's Shorts Comfortable and Breathable (Color : Army Green, Size : 4XL),TXC- Summer Men's Shorts Cotton Loose Large Size Men's Casual Five-Point Pants Wear Men's Shorts Comfortable and Breathable (Color : Khaki+Orange, Size : 5XL),Running Fast Dry Shorts Mens Gym Fitness Sport Bermuda Jogging Training Shorts Summer Male Multi-Pocket Beach Sweatpants,TXC- Summer Men's Shorts Cotton Loose Large Size Men's Casual Five-Point Pants Wear Men's Shorts Comfortable and Breathable (Color : Army Green+Khaki, Size : L),TXC- Summer Men's Shorts Cotton Loose Large Size Men's Casual Five-Point Pants Wear Men's Shorts Comfortable and Breathable (Color : Army Green, Size : XL),TXC- Summer Men's Shorts Cotton Loose Large Size Men's Casual Five-Point Pants Wear Men's Shorts Comfortable and Breathable (Color : Khaki, Size : 4XL),TXC- Summer Men's Shorts Cotton Loose Large Size Men's Casual Five-Point Pants Wear Men's Shorts Comfortable and Breathable (Color : Dark Blue+Khaki, Size : 5XL),TXC- Summer Men's Shorts Cotton Loose Large Size Men's Casual Five-Point Pants Wear Men's Shorts Comfortable and Breathable (Color : Military Green, Size : 4XL),TXC- Summer Men's Shorts Cotton Loose Large Size Men's Casual Five-Point Pants Wear Men's Shorts Comfortable and Breathable (Color : Black, Size : 2XL),TXC- Summer Men's Shorts Cotton Loose Large Size Men's Casual Five-Point Pants Wear Men's Shorts Comfortable and Breathable (Color : Military Green, Size : 3XL),Running Fast Dry Shorts Mens Gym Fitness Sport Bermuda Jogging Training Shorts Summer Male Multi-Pocket Beach Sweatpants,chenshiba Men Camo Cargo Shorts Multi-Pocket Outdoor Camouflage Cargo Shorts Cotton Pants,Men's Casual Elastic Waist Drawstring Knit Shorts,EnergyWDMen Solid Color Pockets Zipper Cut Out Drawstring Fitness Jogger Gym Shorts,MogogN Men's Thin Mid-Rise Hole Stretch Casual Pocket Denim Short Trousers,Howely Men Highwaist Stretchy Pocket Solid Thin Relaxed-Fit Denim Shorts,Howely Men's Stretchy Fabric Holes Mid-Rise Thin Pockets Casual Jeans Biker Shorts,EnergyWD Mens Thin Holes Pure Color Pockets Mid-Rise Breathable Summer Jeans Shorts,Howely Men Elastic Waist Pockets Color Block Stripes Casual Workout Running Shorts,MogogN Men's Pocketed Stripes Casual Colorblock Elastic Waist Sport Short Pants,Howely Mens Solid Colored Pocketed Cut Out Zip Up Elastic Waist Loose Sweat Shorts,EnergyWD Mens Star Color Block Drawstring Stretchy Personalized Sport Short Pants,MogogN Mens Pure Color Stretchy Thin Pocketed Loose Highwaist Denim Shorts,MogogN Mens Solid Casual Smocked Waist Multi-Pocket Drawstring Cargo Shorts Pants","77,121,77,79,79,77,77,109,85,103,115,97,73,85,77,109,79,79,109,109,103,77,79,121,79,85,77,22,147,29,40,25,30,43,22,32,19,30,35,30",,,"https://m.media-amazon.com/images/I/51MdgZRHVgL._AC_UL320_.jpg,https://m.media-amazon.com/images/I/51MdgZRHVgL._AC_UL320_.jpg,https://m.media-amazon.com/images/I/61MgbXxfV3L._AC_UL320_.jpg,https://m.media-amazon.com/images/I/61rIUo+vTfL._AC_UL320_.jpg,https://m.media-amazon.com/images/I/51MdgZRHVgL._AC_UL320_.jpg,https://m.media-amazon.com/images/I/51zT3Lmh2wL._AC_UL320_.jpg,https://m.media-amazon.com/images/I/61f2GRC3O5L._AC_UL320_.jpg,https://m.media-amazon.com/images/I/51r6ZdW8BiL._AC_UL320_.jpg,https://m.media-amazon.com/images/I/51F2vKpKcCL._AC_UL320_.jpg,https://m.media-amazon.com/images/I/51L99oDCsBL._AC_UL320_.jpg,https://m.media-amazon.com/images/I/61wf7Yf+CiL._AC_UL320_.jpg,https://m.media-amazon.com/images/I/61ZAlPnKY5L._AC_UL320_.jpg,https://m.media-amazon.com/images/I/51KLjCdARgL._AC_UL320_.jpg,https://m.media-amazon.com/images/I/61kgZVNRJpL._AC_UL320_.jpg,https://m.media-amazon.com/images/I/61+YyLPbGLL._AC_UL320_.jpg,https://m.media-amazon.com/images/I/51X6fJj1bjL._AC_UL320_.jpg,https://m.media-amazon.com/images/I/6192hWQ0e2L._AC_UL320_.jpg,https://m.media-amazon.com/images/I/51z-7qvy5mL._AC_UL320_.jpg,https://m.media-amazon.com/images/I/51X6fJj1bjL._AC_UL320_.jpg,https://m.media-amazon.com/images/I/61wolK+Ho2L._AC_UL320_.jpg,https://m.media-amazon.com/images/I/61mFsqVWbBL._AC_UL320_.jpg,https://m.media-amazon.com/images/I/61YRHT85XbL._AC_UL320_.jpg,https://m.media-amazon.com/images/I/51WQ8mJTqNL._AC_UL320_.jpg,https://m.media-amazon.com/images/I/61R48okdiCL._AC_UL320_.jpg,https://m.media-amazon.com/images/I/51GwH6eH4yL._AC_UL320_.jpg,https://m.media-amazon.com/images/I/61VeFAyzdgL._AC_UL320_.jpg,https://m.media-amazon.com/images/I/51L99oDCsBL._AC_UL320_.jpg,https://m.media-amazon.com/images/I/610zKV-sdhL._AC_UL320_.jpg,https://m.media-amazon.com/images/I/614t1iAQ+8L._AC_UL320_.jpg,https://m.media-amazon.com/images/I/61BZJ+EfG2L._AC_UL320_.jpg,https://m.media-amazon.com/images/I/61WKw+lWHSL._AC_UL320_.jpg,https://m.media-amazon.com/images/I/51Pgmqw-A5L._AC_UL320_.jpg,https://m.media-amazon.com/images/I/5163aqBiKTL._AC_UL320_.jpg,https://m.media-amazon.com/images/I/61Gk3y40M5L._AC_UL320_.jpg,https://m.media-amazon.com/images/I/51MdgZRHVgL._AC_UL320_.jpg,https://m.media-amazon.com/images/I/61c3UOgVhbL._AC_UL320_.jpg,https://m.media-amazon.com/images/I/41gR7sfe2iL._AC_UL320_.jpg,https://m.media-amazon.com/images/I/61RuksNgQ+L._AC_UL320_.jpg,https://m.media-amazon.com/images/I/51FxyvEg6TL._AC_UL320_.jpg,https://m.media-amazon.com/images/I/61PcvXkR3CL._AC_UL320_.jpg,https://m.media-amazon.com/images/I/51FxyvEg6TL._AC_UL320_.jpg,https://m.media-amazon.com/images/I/71nXjk8Sb3L._AC_UL320_.jpg,https://m.media-amazon.com/images/I/51kzlaoHUyL._AC_UL320_.jpg,https://m.media-amazon.com/images/I/51Yikt6jA8L._AC_UL320_.jpg,https://m.media-amazon.com/images/I/61sQxQt87EL._AC_UL320_.jpg,https://m.media-amazon.com/images/I/61b7D5N8T6L._AC_UL320_.jpg,https://m.media-amazon.com/images/I/612oUggOxGL._AC_UL320_.jpg,https://m.media-amazon.com/images/I/61A+RbRoubL._AC_UL320_.jpg"
"Howely Men's Mid-Rise Thin Solid Distressed Pocketed Straight Denim Short Trousers,Howely Mens Solid Drawstring Smocked Waist Multi-Pocket Casual Twill Cargo Shorts,EnergyWD Mens Thin Solid Pocket Highwaist Stretch Straight Denim Short Trousers,EnergyWDMen Colorblock Star Pockets Mid Waist Stretchy Stylish Sport Short Pants,Howely Mens Star Pocketed Stretchy Mid-Rise Splicing Personalized Sweat Shorts,EnergyWD Men's Colorblock Striped with Pocket Drawstring Fashion Short Pants,GIKE Casual and Versatile Deodorant, Sweat Absorbing, Breathable and Health Care Socks Cotton Business Socks(5 Pair Gift Box) Black Grey,MogogN Men's Pockets Stretch Splicing Star Personalized Mid-Rise Yoga Shorts,EnergyWDMen Solid Multi-Pocket Drawstring Elastic Waist Straight Cargo Shorts Pants,MogogNMen Drawstring Printed Straight-Fit Stretch Color Block Sweat Shorts,Diamond Supply Co. Men's French Terry Shorts Black,Howely Men's Printed Stretchy Fabric Splicing Drawstring Straight-Fit Yoga Shorts,Howely Men Drawstring Printed Colorblock Pockets Straight-Fit Jogger Gym Shorts,MogogNMen Cut Out Smocked Waist Relaxed-Fit Solid Zipper Pockets Yoga Shorts,MogogNMen Pocketed Printing Color Block Straight-Fit Drawstring Sweat Shorts,UNIONBAY Montego Cargo Shorts for Men Assorted Colors and Sizes - Comfort Stretch,Howely Men Summer Plus Size Relaxed-Fit Pockets Zip Up Multicamo Cargo Short,Howely Men Summer Half Pants Sport Casual Loose Board Shorts for Fitness,Katin Kent Short Walk Shorts,MogogN Mens Pure Color Half Pants Summer Beach Board Shorts for Fitness,MogogN Mens Reg and Big and Tall Sizes Half Pants Pockets Zipper Camo Shorts,MogogN Men's Drawstring Half Pants Summer Cargo Short with Side Pockets,MogogNMen Drawstring Pure Colour Big & Tall Baggy Bechwear Short Pants,Howely Mens Casual Loose Solid-Colored Beach Summer Baggy Short Pants,Howely Men Half Pants Loose Summer Beach Printing Relaxed Cargo Shorts,Howely Men's Relaxed Plus-Size Athletic-Fit Summer Half Pants Cargo Shorts,Katin Cord Local Short Shorts,MogogN Men's Multi Pockets Summer Cotton Casual Loose Short Tactical Pants,Howely Mens Fashion Half Pants Baggy Casual Oversized Beach Board Shorts,Howely Mens Drawstring Classic Plaid Summer Relaxed-Fit Classic Board Shorts,MogogN Men's Plus-Size Half Pants Loose Waistband Stretchy Board Shorts,MogogNMen Drawstring Plaid Relaxed Classic-Fit Fashion Board Shorts,Howely Men's Summer Multicamo Loose Beach Straight Beach Board Shorts,Howely Men Summer Classic Multicamo Drawstring Relaxed Fit Beach Shorts,MogogNMen Half Pants Loose Fit Multicam Beach Summer Beach Board Shorts,MogogN Men's Drawstring Multicam Accept Waist Summer Classic Beach Shorts,MogogNMen Half Pants Loose Fit Multicam Summer Casual Straight Board Shorts,Howely Men's Half Pants Camo Straight Sport Baggy Beach Board Shorts,Howely Men Floral Half Pants Reg and Big and Tall Sizes Baggy Board Shorts,Yuanyistyle Men's Running Shorts, 2 in 1 Breathable Sports Short Quick Drying Gym Athletic Workout Jogging Training Exercise Pants with Pockets,EnergyWDMen Solid Splice Sequin Drawstring Elastic Waist Straight-Fit Yoga Shorts,EnergyWDMen Multi-Pocket Solid Mid Waist Drawstring Straight-Fit Twill Cargo Shorts,EnergyWDMen Color Block Patterned Pocketed Drawstring Fashion Jogger Gym Shorts,MogogN Mens Drawstring Casual Floral Printed Gradient Ramp Beach Board Shorts,MogogNMen Drawstring Casual Active Contrast Beach Board Shorts with Pockets,EnergyWD Mens Colorblock Pockets Smocked Waist Drawstring Slim Fit Sweat Shorts,EnergyWD Mens Pure Color Pocket Stretchy Fabric Mid-Rise Straight Denim Shorts,MogogN Mens Relaxed-Fit Beach Active Drawstring Pockets Beach Board Shorts","32,20,35,30,20,32,30,30,25,85,15,16,29,26,69,17,15,118,25,27,26,26,16,16,16,125,31,16,18,26,28,16,16,26,26,26,16,16,28,30,30,32,20,20,34,37,18",4.5 out of 5 stars,102,"https://m.media-amazon.com/images/I/713+EvXqSuL._AC_UL320_.jpg,https://m.media-amazon.com/images/I/71iwtadf3JL._AC_UL320_.jpg,https://m.media-amazon.com/images/I/6163BpnsyoL._AC_UL320_.jpg,https://m.media-amazon.com/images/I/71bTBTIH7kL._AC_UL320_.jpg,https://m.media-amazon.com/images/I/71tP0vhKd9L._AC_UL320_.jpg,https://m.media-amazon.com/images/I/51yulnMpVKL._AC_UL320_.jpg,https://m.media-amazon.com/images/I/619Sgzi1AYL._AC_UL320_.jpg,https://m.media-amazon.com/images/I/71tP0vhKd9L._AC_UL320_.jpg,https://m.media-amazon.com/images/I/61Nf4l2ikLL._AC_UL320_.jpg,https://m.media-amazon.com/images/I/61CWQtZqVpL._AC_UL320_.jpg,https://m.media-amazon.com/images/I/61wgrRCNPGL._AC_UL320_.jpg,https://m.media-amazon.com/images/I/61CWQtZqVpL._AC_UL320_.jpg,https://m.media-amazon.com/images/I/618Uq1vm3xL._AC_UL320_.jpg,https://m.media-amazon.com/images/I/61h6qt1k-kL._AC_UL320_.jpg,https://m.media-amazon.com/images/I/618Uq1vm3xL._AC_UL320_.jpg,https://m.media-amazon.com/images/I/61hbySGyp5L._AC_UL320_.jpg,https://m.media-amazon.com/images/I/712a75hbwiL._AC_UL320_.jpg,https://m.media-amazon.com/images/I/51IcHSpXaBL._AC_UL320_.jpg,https://m.media-amazon.com/images/I/719eB6cZRQL._AC_UL320_.jpg,https://m.media-amazon.com/images/I/51eDfvopBqL._AC_UL320_.jpg,https://m.media-amazon.com/images/I/619YWK6RJbL._AC_UL320_.jpg,https://m.media-amazon.com/images/I/61Ypu+9nELL._AC_UL320_.jpg,https://m.media-amazon.com/images/I/61M-A-y+C3L._AC_UL320_.jpg,https://m.media-amazon.com/images/I/61M-A-y+C3L._AC_UL320_.jpg,https://m.media-amazon.com/images/I/61qX9W-aSoL._AC_UL320_.jpg,https://m.media-amazon.com/images/I/61sCGY0YD+L._AC_UL320_.jpg,https://m.media-amazon.com/images/I/71bBRZXMsrL._AC_UL320_.jpg,https://m.media-amazon.com/images/I/51XOvj03W2L._AC_UL320_.jpg,https://m.media-amazon.com/images/I/615SPuc4cAL._AC_UL320_.jpg,https://m.media-amazon.com/images/I/618YO9ISNgL._AC_UL320_.jpg,https://m.media-amazon.com/images/I/61dsfffs7FL._AC_UL320_.jpg,https://m.media-amazon.com/images/I/610hktfNC3L._AC_UL320_.jpg,https://m.media-amazon.com/images/I/61e5Vc31cUL._AC_UL320_.jpg,https://m.media-amazon.com/images/I/61dIN-6p+8L._AC_UL320_.jpg,https://m.media-amazon.com/images/I/61yLp+4fESL._AC_UL320_.jpg,https://m.media-amazon.com/images/I/61TUMv+DW3L._AC_UL320_.jpg,https://m.media-amazon.com/images/I/71pExbKKUML._AC_UL320_.jpg,https://m.media-amazon.com/images/I/71uSqs6YrBL._AC_UL320_.jpg,https://m.media-amazon.com/images/I/614uIKqDSTL._AC_UL320_.jpg,https://m.media-amazon.com/images/I/61lI3qUlldL._AC_UL320_.jpg,https://m.media-amazon.com/images/I/61PKry27LML._AC_UL320_.jpg,https://m.media-amazon.com/images/I/61jhC+6qBcL._AC_UL320_.jpg,https://m.media-amazon.com/images/I/51nGHHK6P3L._AC_UL320_.jpg,https://m.media-amazon.com/images/I/71lp8taIdkL._AC_UL320_.jpg,https://m.media-amazon.com/images/I/61H00x1n3lL._AC_UL320_.jpg,https://m.media-amazon.com/images/I/61UIUjIz9RL._AC_UL320_.jpg,https://m.media-amazon.com/images/I/517e68crqLL._AC_UL320_.jpg,https://m.media-amazon.com/images/I/61N8+XNxcLL._AC_UL320_.jpg"
"MogogN Mens Drawstring Casual Leisure Contrast Athletic-Fit Straight Shorts,Sullen Men's Chill Fleece Shorts,Funky Buddha Men's Cargo Shorts In Plain Pattern,Marshall Artist Maglia Taped Navy Shorts,Funky Buddha Men's Cargo Shorts In Allover Print,Lacoste Men's Slim fit Chino Shorts, Beige,Howely Men Stretchy Pocket Solid Color Mid-Rise Slim-Fit Summer Jeans Shorts,Howely Men Drawstring Elastic Waist Pocket Colorblock Personalized Yoga Shorts,Howely Mens Pure Color Splice Drawstring Sequin Elastic Waist Casual Yoga Shorts,MogogN Men's Smocked Waist Solid Drawstring Splice Straight Sequin Yoga Shorts,MogogN Mens Drawstring Colorblock Pockets Elastic Waist Slim Jogger Gym Shorts,MogogN Mens Straight Mid Waist Pocket Stretchy Solid Moto Denim Short Pants,MogogNMen Drawstring Solid Straight Mid Waist Multi-Pocket Tactical Pants Shorts,Howely Men's Pure Color Drawstring Mid-Rise Multi-Pocket Casual Cargo Twill Shorts,Howely Mens Patterned Splicing with Pocket Smocked Waist Casual Yoga Shorts,MogogNMen Color Block Pocketed Drawstring Patterned Fashion Sport Short Pants,UUYUK Men Casual Elastic Waist Loose Fit Beach Shorts Boardshort,MogogN Men's Pure Colour Half Pants Loose 3/4 Length Pants Beach Cargo Shorts,MogogNMen Plus Size Half Pants Multi-Pockets Baggy Washed Summer Shorts,SIR7 Men's Linen Casual Classic Fit 11 Inch Inseam Elastic Waist Shorts with Drawstring,UUYUK Men Casual Cotton Linen Straight Leg Beach Shorts Boardshort,UUYUK Men Casual Solid Drawstring Straight Leg Beach Shorts Boardshort,Thom Browne Luxury Fashion Mens MJQ052A06222055 Grey Shorts | Spring Summer 20,Jil Sander Luxury Fashion Mens JSMQ311631MQ390600001 Black Shorts | Spring Summer 20,PAURA CLOTHING Luxury Fashion Mens 03DP5012M06090 Black Shorts | Spring Summer 20,MAISON KITSUN Luxury Fashion Mens EM01405WW000KAHKI Green Shorts | Spring Summer 20,DONDUP Luxury Fashion Mens UP454DS0107AA9800 Blue Shorts | Spring Summer 20,Dolce e Gabbana Luxury Fashion Mens GW8PATFI1RDHA1LO Gold Shorts | Spring Summer 20,Comfortable Shorts Men's Shorts Beach Shorts Summer Sports Shorts Comfortable Breathable Shorts Blue/Black Fit (Color : Black, Size : S),neveraway Mens Relaxed Fit Floral Printed Gradient Ramp Drawstring Shorts,neveraway Mens Casual Leisure Drawstring Beach Pockets Athletic-Fit Shorts,neveraway Men's Quick Dry Casual Leisure Sport Bechwear Summer Beach Shorts,neveraway Men Summer Half Pants Classic-Fit Multi-Pockets Loose Cargo Shorts,neveraway Men Straight-Fit Plus-Size Half Pants Summer Pockets Short Pants,neveraway Men's Half Pants Baggy Straight Leg Relaxed Summer Cargo Short,neveraway Men's Athletic Fit Summer Oversized Straight Leg Loose Short Pants,neveraway Mens Relaxed-Fit Half Pants Summer Straight Shorts with Side Pockets,neveraway Mens Striped Oversized Pockets Straight-Fit 3/4 Length Pants Shorts,neveraway Men's Plus-Size Half Pants Summer Relaxed Fit Straight Shorts,neveraway Mens Summer Athletic Half Pants Relaxed-Fit Solid Color Beach Shorts,Howely Men Summer Multi-Pockets Straight Half Pants Plus Size Cargo Short,Howely Men Summer Half Pants Casual Pockets Plus-Size Straight Cargo Short,Howely Men's Straight-Fit Half Pants Summer Plaid Relaxed-Fit Cargo Shorts,Howely Men Half Pants Straight Leg Relaxed Loose Fit Summer Cargo Short,Howely Men's Beach Athletic Fit 3/4 Pants Summer Relaxed Fit Beach Shorts,Howely Men Sports Half Pants Bechwear Summer Loose-Fit Beach Shorts,Howely Men Half Pants Classic Summer Multi-Pockets Loose Short Pants,Howely Mens Summer Waistband Stretchy Active Half Pants Beach Board Shorts","18,63,138,60,142,204,27,24,20,30,34,32,30,20,17,32,24,37,41,34,18,28,1,398,820,494,410,410,1,482,64,18,18,28,35,32,36,38,37,41,35,26,27,22,27,26,18,19,25,15","5.0 out of 5 stars,4.0 out of 5 stars","4,61","https://m.media-amazon.com/images/I/61cXYayajnL._AC_UL320_.jpg,https://m.media-amazon.com/images/I/71H1cOaIZKL._AC_UL320_.jpg,https://m.media-amazon.com/images/I/714WN318nhL._AC_UL320_.jpg,https://m.media-amazon.com/images/I/5198II45kQL._AC_UL320_.jpg,https://m.media-amazon.com/images/I/71OwR8kNs8L._AC_UL320_.jpg,https://m.media-amazon.com/images/I/815tuK-AUtL._AC_UL320_.jpg,https://m.media-amazon.com/images/I/51WQ0gfO1OL._AC_UL320_.jpg,https://m.media-amazon.com/images/I/61J5ST32NAL._AC_UL320_.jpg,https://m.media-amazon.com/images/I/61CsVwN0TDL._AC_UL320_.jpg,https://m.media-amazon.com/images/I/51ScIolTS6L._AC_UL320_.jpg,https://m.media-amazon.com/images/I/51odOrbngzL._AC_UL320_.jpg,https://m.media-amazon.com/images/I/51cKwR22-OL._AC_UL320_.jpg,https://m.media-amazon.com/images/I/61dHAY+TVKL._AC_UL320_.jpg,https://m.media-amazon.com/images/I/51aqUGTTr6L._AC_UL320_.jpg,https://m.media-amazon.com/images/I/51qAOEF96KL._AC_UL320_.jpg,https://m.media-amazon.com/images/I/51iy6qKjNdL._AC_UL320_.jpg,https://m.media-amazon.com/images/I/61lqu1t7MKL._AC_UL320_.jpg,https://m.media-amazon.com/images/I/61-Vdr+7KkL._AC_UL320_.jpg,https://m.media-amazon.com/images/I/613AsXqBVEL._AC_UL320_.jpg,https://m.media-amazon.com/images/I/91v5MTBx79L._AC_UL320_.jpg,https://m.media-amazon.com/images/I/61mEFxGqMyL._AC_UL320_.jpg,https://m.media-amazon.com/images/I/51aco7xdDUL._AC_UL320_.jpg,https://m.media-amazon.com/images/I/71sXqISs+KL._AC_UL320_.jpg,https://m.media-amazon.com/images/I/61UnluhkrmL._AC_UL320_.jpg,https://m.media-amazon.com/images/I/61Zi6XoWMQL._AC_UL320_.jpg,https://m.media-amazon.com/images/I/614hlKyzv5L._AC_UL320_.jpg,https://m.media-amazon.com/images/I/81Df9oemRqL._AC_UL320_.jpg,https://m.media-amazon.com/images/I/71DEQFl3ctL._AC_UL320_.jpg,https://m.media-amazon.com/images/I/51thvB4sxCL._AC_UL320_.jpg,https://m.media-amazon.com/images/I/81cYZFSHeOL._AC_UL320_.jpg,https://m.media-amazon.com/images/I/51rLzbi2WvL._AC_UL320_.jpg,https://m.media-amazon.com/images/I/71dFlTQDy5L._AC_UL320_.jpg,https://m.media-amazon.com/images/I/718GKsKsnBL._AC_UL320_.jpg,https://m.media-amazon.com/images/I/61Dn1zY+oVL._AC_UL320_.jpg,https://m.media-amazon.com/images/I/612jUN773ML._AC_UL320_.jpg,https://m.media-amazon.com/images/I/61dd1-SxCwL._AC_UL320_.jpg,https://m.media-amazon.com/images/I/71Kc58k2YaL._AC_UL320_.jpg,https://m.media-amazon.com/images/I/71WPXMR255L._AC_UL320_.jpg,https://m.media-amazon.com/images/I/61wP--OWt6L._AC_UL320_.jpg,https://m.media-amazon.com/images/I/51IxL9VhHTL._AC_UL320_.jpg,https://m.media-amazon.com/images/I/61dd1-SxCwL._AC_UL320_.jpg,https://m.media-amazon.com/images/I/61eZIaFCWcL._AC_UL320_.jpg,https://m.media-amazon.com/images/I/71UPa7gaC+L._AC_UL320_.jpg,https://m.media-amazon.com/images/I/61rl6CWFufL._AC_UL320_.jpg,https://m.media-amazon.com/images/I/71-vZmwibeL._AC_UL320_.jpg,https://m.media-amazon.com/images/I/61KoQF-Wn3L._AC_UL320_.jpg,https://m.media-amazon.com/images/I/718GKsKsnBL._AC_UL320_.jpg,https://m.media-amazon.com/images/I/61NF77T3knL._AC_UL320_.jpg"
