product_name,product_price,product_rating,people_rated,product_imglink
"canterbury Men's Tactic Short,GUNLIRE Denim Shorts for Men Summer Vintage Washed Ripped Distressed Straight Fit Knee Length Casual Jean Shorts,Goodthreads Amazon Brand Men's 9"" Inseam Comfort Stretch Linen Cotton Short,Dickies Mens 640F 13 Inch Flex Relaxed Fit Multi-Pocket Work Short Shorts,Amazon Essentials Men's Classic-Fit 7"" Print Short,Champion Mens 85699 Middleweight Short Casual Shorts,canterbury Men's Panelled Tactic Shorts Senior,St. Goliath Men's Oath Short,Hurley Men's Phantom 20"" Walkshorts,Lee Men's Performance Series Extreme Comfort Short,famuka Mens Casual Cotton Military Style Multi Pocket Cargo Shorts,Levi's Men's 505 Regular Fit Short,BIG BEE Mens Work Cargo Shorts, Cotton Drill Canvas, Multi Pockets,TRADIE,Heavy Duty,Helly Hansen Men's Hh Qd Cargo Shorts 11,Amazon Essentials Men's Classic-Fit Cargo Short,CALVIN KLEIN Men's Slim Straight Fit Denim Jean Shorts,Quiksilver Men's New Everyday Union Stretch,Bonds Men's Originals Short,Lee,Wrangler,Soffe MJ Men's Classic Cotton Pocket Short, 2 Pack,Linemoon Men's Linen Casual Short Flat Front Gym Short for Beach,OCHENTA Men's Cotton Loose Fit Multi Pocket Cargo Shorts,US Apparel Men's Solid Color Cargo Style Microfiber Board Shorts,Lee,Levi's Men's 505 Regular Fit Short,Tommy Bahama Men's Boracay 10-Inch Chino Shorts,Columbia Men's Silver Ridge Cargo,Amazon Essentials Men's Slim-Fit Flat-Front Linen Short - 9"",Haggar Men's Cool 18,TACVASEN Men's Casual Twill Elastic Cargo Shorts Below Knee Loose Fit Multi-Pocket Capri Long Shorts,Rip Curl Men's Trail Cargo 21"" Walkshort Shorts,Hugo Boss Mens 50389236 Mix&Match Shorts 10143871 01 Shorts,OCHENTA Men's Cotton Regular Fit Flat-Front Short,Rip Curl Mens Savage Walk Shorts Shorts,Dickies Men's 11 Inch Relaxed Fit Stretch Twill Work Short,Dickies Men's 13 Inch Loose Fit Twill Cargo Short,Fila Men's Unisex Verona Short,CALVIN KLEIN Men's 5-Pocket Calvary Twill Shorts,Wrangler Mens Premium Relaxed Fit Twill Cargo Short Cargo Shorts,Champion Mens G856H Graphic Jersey Short Casual Shorts - Blue,Goodthreads Amazon Brand Men's 9"" Inseam Flat-Front Comfort Stretch Chino Short,Goodthreads Men's 5"" Inseam Stretch Seersucker Short,Dickies Men's,Armani Exchange Men's Beach Shorts, Black, L,Dickies Men's 13 Inch Regular Fit Shadow Stripe Short,Goodthreads Men's 7"" Inseam Stretch Seersucker,Wrangler Men's Cigi Short","34,46,9,16,31,24,13,61,48,29,51,31,99,57,27,52,28,44,34,52,38,52,35,284,54,9,47,34,63,69,27,86,34,38,99,36,20,28,23,40,28,36,43,99","4.4 out of 5 stars,4.0 out of 5 stars,4.2 out of 5 stars,4.1 out of 5 stars,4.1 out of 5 stars,4.0 out of 5 stars,4.4 out of 5 stars,4.7 out of 5 stars,4.6 out of 5 stars,4.0 out of 5 stars,4.8 out of 5 stars,4.4 out of 5 stars,2.0 out of 5 stars,3.6 out of 5 stars,5.0 out of 5 stars,4.6 out of 5 stars,4.4 out of 5 stars,4.6 out of 5 stars,3.7 out of 5 stars,3.8 out of 5 stars,4.7 out of 5 stars,4.7 out of 5 stars,3.8 out of 5 stars,4.6 out of 5 stars,4.3 out of 5 stars,5.0 out of 5 stars,4.0 out of 5 stars,5.0 out of 5 stars,3.8 out of 5 stars,4.4 out of 5 stars,4.3 out of 5 stars,4.6 out of 5 stars,4.1 out of 5 stars,4.4 out of 5 stars,4.5 out of 5 stars,4.4 out of 5 stars,4.6 out of 5 stars","7,18,67,70,203,1,34,663,250,1,52,3,304,1,18,1,711,201,3,1,482,63,175,2,035,5,258,57,1,1,1,113,1,183,2,373,392,268,77,123,53,45","https://m.media-amazon.com/images/I/71DCCrKPiuL._AC_UL320_.jpg,https://m.media-amazon.com/images/I/71LjMrjKQwL._AC_UL320_.jpg,https://m.media-amazon.com/images/I/81mUnCrR87L._AC_UL320_.jpg,https://m.media-amazon.com/images/I/71YOngeCIsL._AC_UL320_.jpg,https://m.media-amazon.com/images/I/717OQtHtlUL._AC_UL320_.jpg,https://m.media-amazon.com/images/I/71Nc0QUse9L._AC_UL320_.jpg,https://m.media-amazon.com/images/I/81bEKlft39L._AC_UL320_.jpg,https://m.media-amazon.com/images/I/712FplYo8sL._AC_UL320_.jpg,https://m.media-amazon.com/images/I/71TICrqNtSL._AC_UL320_.jpg,https://m.media-amazon.com/images/I/71ISzglgiBL._AC_UL320_.jpg,https://m.media-amazon.com/images/I/71X3OGCvRML._AC_UL320_.jpg,https://m.media-amazon.com/images/I/81l10TekG2L._AC_UL320_.jpg,https://m.media-amazon.com/images/I/515RBKDeNuL._AC_UL320_.jpg,https://m.media-amazon.com/images/I/81w6deDHcgL._AC_UL320_.jpg,https://m.media-amazon.com/images/I/81Izvvfd+gL._AC_UL320_.jpg,https://m.media-amazon.com/images/I/91KTcTPBcOL._AC_UL320_.jpg,https://m.media-amazon.com/images/I/8171kIzCJXL._AC_UL320_.jpg,https://m.media-amazon.com/images/I/71K0HQv4hSL._AC_UL320_.jpg,https://m.media-amazon.com/images/I/81NBo7gRG9L._AC_UL320_.jpg,https://m.media-amazon.com/images/I/91hw11dx2BL._AC_UL320_.jpg,https://m.media-amazon.com/images/I/714bnK+vUTL._AC_UL320_.jpg,https://m.media-amazon.com/images/I/61VaSB5SS1L._AC_UL320_.jpg,https://m.media-amazon.com/images/I/517i82yrC7L._AC_UL320_.jpg,https://m.media-amazon.com/images/I/71VNgLJmIcL._AC_UL320_.jpg,https://m.media-amazon.com/images/I/71Z22cO6wAL._AC_UL320_.jpg,https://m.media-amazon.com/images/I/81l10TekG2L._AC_UL320_.jpg,https://m.media-amazon.com/images/I/61qmWgKhg4L._AC_UL320_.jpg,https://m.media-amazon.com/images/I/71+hHybsxlL._AC_UL320_.jpg,https://m.media-amazon.com/images/I/714afkBZagL._AC_UL320_.jpg,https://m.media-amazon.com/images/I/81ho11Eg47L._AC_UL320_.jpg,https://m.media-amazon.com/images/I/61KRQUhpWDL._AC_UL320_.jpg,https://m.media-amazon.com/images/I/81qTwJuRNNL._AC_UL320_.jpg,https://m.media-amazon.com/images/I/81Cq9C5NynL._AC_UL320_.jpg,https://m.media-amazon.com/images/I/61yNPOKtqNL._AC_UL320_.jpg,https://m.media-amazon.com/images/I/71tbwotz5BL._AC_UL320_.jpg,https://m.media-amazon.com/images/I/81Uj9GWc8QL._AC_UL320_.jpg,https://m.media-amazon.com/images/I/818r4YxR7SL._AC_UL320_.jpg,https://m.media-amazon.com/images/I/71zwrTzxcIL._AC_UL320_.jpg,https://m.media-amazon.com/images/I/81oAW6wj4qL._AC_UL320_.jpg,https://m.media-amazon.com/images/I/81kbmIuW2OL._AC_UL320_.jpg,https://m.media-amazon.com/images/I/71dPZcGAqYL._AC_UL320_.jpg,https://m.media-amazon.com/images/I/81oWKN7PtuL._AC_UL320_.jpg,https://m.media-amazon.com/images/I/81zq4tOSvrL._AC_UL320_.jpg,https://m.media-amazon.com/images/I/81Jx0ynLWtL._AC_UL320_.jpg,https://m.media-amazon.com/images/I/81dlcIgDIOL._AC_UL320_.jpg,https://m.media-amazon.com/images/I/7132KuQxNjL._AC_UL320_.jpg,https://m.media-amazon.com/images/I/81z1ZLFhplL._AC_UL320_.jpg,https://m.media-amazon.com/images/I/81f2yami4xL._AC_UL320_.jpg"
"Wrangler Men's CIGI Short,Buttoned Down Men's Slim-Fit Flat Front 9"" Inseam Non-Iron Chino Short,Elonglin Men's Summer Sport Shorts Casual Outdoor Lightweight Quick-Dry Shorts Big Size Elastic Waist Drawstring Workout Shorts with Pockets,Quiksilver Mens EQYWS03586 Union Ripstop Amphibian 20 Walk Short Casual Shorts,French Connection Men's Charlie Chino Short,Amazon Essentials Men's Big & Tall Classic-fit Flat-Front Short fit by DXL,Quiksilver Waterman Men's Cabo 6 Walk Short,Silent Theory Men's Shadow Short,westAce Mens Cargo Combat Shorts Casual Work Wear 100% Cotton Cargo Half Pants,Wrangler Mens Big & Tall Classic Relaxed Fit Stretch Cargo Short Shorts,LEE Men's Z-Roadie Short,Tommy Hilfiger Men's 6 Pocket Cargo Shorts,Dickies Unisex-Adult 13 Inch Flex Multi-Pocket Work Short Loose Fit Shorts,Rip Curl Men's Twisted 19"" Walkshort,ASICS Australia Men's Icon Sprinter, Performance Black/Dark Grey,Surplus Men's Stars Bermuda Dark Blue,TBMPOY Men's Cotton Casual Shorts 3/4 Jogger Capri Pants Breathable Below Knee Short Pants with Zipper Pockets,Rip Curl Men's Secret 20"" Boardwalk Shorts,Red Kap Men's Shop Short,Dickies Men's 15 Inch Inseam Work Short with Multi Use Pocket,westAce New Mens Denim Shorts Super Flex Slim Fit Stretch Chino Half Pants Jeans Shorts,D555 Mens John Big Tall King Size Lightweight Cotton Cargo Shorts,J.Crew Mercantile Mens H5020 9"" Inseam Flat-Front Stretch Chino Short Casual Shorts,Lee Mens 21861 Extreme Motion Swope Cargo Short Cargo Shorts,Rip Curl Men's Jackson 20"" Boardwalk Shorts,Champion LIFE,FSSE Men Basic Solid Cotton Multi-Pockets Straight Leg Rugged Cargo Shorts,Nautica Men's Flat Front,Men's Outdoor Tactical Shorts Lightweight Expandable Waist Cargo Shorts with Multi Pockets Quick Dry Water Resistant #6222,canterbury Professional Short, 5XL,Rip Curl Men's Mirage Mf React Fade Shorts,New Balance New BalanceNB ATHLTCS SHRT N36,Dickies Men's 11 Inch Slim Fit Stretch Twill Work Short,Goodthreads Men's,Champion Men's Script Jersey Short,canterbury Men's Tonal Tactic Short,prAna Men's Bronson 11-Inch Inseam Shorts,AOYOG Mens Multi-Pocket Camo Cargo Shorts Casual Loose Fit Camouflage Short Cotton,The North Face Men's M Paramount Trail Short,dockers Men's Supreme Flex Ultimate Short,EKLENTSON Mens Outdoor Stretch Waist Thin Quick Drying Shorts Lightweight Slim Fit Cargo Shorts (No Belt),Goodthreads Men's 11"" Inseam Linen Cotton Short,Amazon Essentials Men's  Short,Dickies Men's 9 1/2,Goodthreads Men's 5"" Inseam Linen Cotton Short,westAce Mens Army Casual Work Cargo Combat Camouflage Shorts 6 Pocket Half Pants,G-Star Raw Men's Rovic Zip Relaxed 1 Shorts,Lee Mens 22861 Big-Tall Extreme Motion Swope Cargo Short Cargo Shorts","99,14,9,75,47,38,49,44,99,143,39,71,83,34,79,48,33,19,45,39,52,79,53,21,55,38,39,63,48,34,35,24,23,83,45,95,43,11,28,31,13,19,120,60","4.2 out of 5 stars,5.0 out of 5 stars,5.0 out of 5 stars,4.4 out of 5 stars,2.6 out of 5 stars,4.6 out of 5 stars,4.3 out of 5 stars,3.6 out of 5 stars,5.0 out of 5 stars,5.0 out of 5 stars,4.4 out of 5 stars,4.1 out of 5 stars,4.6 out of 5 stars,3.9 out of 5 stars,4.5 out of 5 stars,4.1 out of 5 stars,4.2 out of 5 stars,4.7 out of 5 stars,4.3 out of 5 stars,4.7 out of 5 stars,3.5 out of 5 stars,5.0 out of 5 stars,4.3 out of 5 stars,4.3 out of 5 stars,2.9 out of 5 stars,3.2 out of 5 stars,5.0 out of 5 stars,3.7 out of 5 stars,4.3 out of 5 stars,5.0 out of 5 stars,3.7 out of 5 stars,4.0 out of 5 stars,4.2 out of 5 stars,4.5 out of 5 stars,4.5 out of 5 stars,3.5 out of 5 stars,4.7 out of 5 stars","19,1,1,268,7,175,99,30,1,1,4,22,97,997,15,8,23,227,16,2,101,2,458,696,3,5,3,877,46,1,84,26,1,020,212,64,2,203","https://m.media-amazon.com/images/I/81dq9tEVCVL._AC_UL320_.jpg,https://m.media-amazon.com/images/I/714JVixiw8L._AC_UL320_.jpg,https://m.media-amazon.com/images/I/31ysBMrn+YL._AC_UL320_.jpg,https://m.media-amazon.com/images/I/81VweTPqqWL._AC_UL320_.jpg,https://m.media-amazon.com/images/I/71f+HbRnvtL._AC_UL320_.jpg,https://m.media-amazon.com/images/I/81m5r8nBuxL._AC_UL320_.jpg,https://m.media-amazon.com/images/I/713PZTcfj7L._AC_UL320_.jpg,https://m.media-amazon.com/images/I/71WkFeXYugL._AC_UL320_.jpg,https://m.media-amazon.com/images/I/71x40Bh83tL._AC_UL320_.jpg,https://m.media-amazon.com/images/I/81gybSCBxcL._AC_UL320_.jpg,https://m.media-amazon.com/images/I/81YiyqMkltL._AC_UL320_.jpg,https://m.media-amazon.com/images/I/719ALBPoTJL._AC_UL320_.jpg,https://m.media-amazon.com/images/I/81zTNU7RNbL._AC_UL320_.jpg,https://m.media-amazon.com/images/I/51Hp8BZ1PML._AC_UL320_.jpg,https://m.media-amazon.com/images/I/81cjbl12hgL._AC_UL320_.jpg,https://m.media-amazon.com/images/I/91Y6ip1rXIL._AC_UL320_.jpg,https://m.media-amazon.com/images/I/71Kltc9U08L._AC_UL320_.jpg,https://m.media-amazon.com/images/I/818+laW-AAL._AC_UL320_.jpg,https://m.media-amazon.com/images/I/81-NB+g77ZL._AC_UL320_.jpg,https://m.media-amazon.com/images/I/81vpWpUrMVS._AC_UL320_.jpg,https://m.media-amazon.com/images/I/819dBKxysLL._AC_UL320_.jpg,https://m.media-amazon.com/images/I/71vocNIS+JL._AC_UL320_.jpg,https://m.media-amazon.com/images/I/71yK5df1oBL._AC_UL320_.jpg,https://m.media-amazon.com/images/I/81aZnv7ay2L._AC_UL320_.jpg,https://m.media-amazon.com/images/I/81G8BmawCsL._AC_UL320_.jpg,https://m.media-amazon.com/images/I/81EQzH1GYcL._AC_UL320_.jpg,https://m.media-amazon.com/images/I/61hAIV-gdvL._AC_UL320_.jpg,https://m.media-amazon.com/images/I/81zawbR1h3L._AC_UL320_.jpg,https://m.media-amazon.com/images/I/61xx3bsyv3L._AC_UL320_.jpg,https://m.media-amazon.com/images/I/71OM3JO8RPL._AC_UL320_.jpg,https://m.media-amazon.com/images/I/81ZxgkX36nL._AC_UL320_.jpg,https://m.media-amazon.com/images/I/811hz0DcVkL._AC_UL320_.jpg,https://m.media-amazon.com/images/I/81L8mKmzQZL._AC_UL320_.jpg,https://m.media-amazon.com/images/I/81mBIzmDczL._AC_UL320_.jpg,https://m.media-amazon.com/images/I/71aiXbfsd-L._AC_UL320_.jpg,https://m.media-amazon.com/images/I/71QtboDsW8L._AC_UL320_.jpg,https://m.media-amazon.com/images/I/81pRVigwnLL._AC_UL320_.jpg,https://m.media-amazon.com/images/I/81lTvTXU5LL._AC_UL320_.jpg,https://m.media-amazon.com/images/I/81+uI3eYSOL._AC_UL320_.jpg,https://m.media-amazon.com/images/I/51FXLIYFvVL._AC_UL320_.jpg,https://m.media-amazon.com/images/I/614xqxvl9OL._AC_UL320_.jpg,https://m.media-amazon.com/images/I/81xVo6aLURL._AC_UL320_.jpg,https://m.media-amazon.com/images/I/71F9LcFq2-L._AC_UL320_.jpg,https://m.media-amazon.com/images/I/91XGbmPnxxS._AC_UL320_.jpg,https://m.media-amazon.com/images/I/810DKPvHQjL._AC_UL320_.jpg,https://m.media-amazon.com/images/I/71aOnXoUqQL._AC_UL320_.jpg,https://m.media-amazon.com/images/I/71wvn1SP8IL._AC_UL320_.jpg,https://m.media-amazon.com/images/I/917107oF5xL._AC_UL320_.jpg"
"westAce Mens Chino Shorts Casual Cargo Combat Flat Front 100% Cotton Half Pant,Ling-long 2019 Summer Men's Cargo Shorts New Men Casual Short Men Tooling Shorts Male Casual Shorts,Champion Mens 81622C Shorts with Year Span Shorts,Goodthreads Men's,westAce Mens Cargo Combat Shorts Work Wear Cotton Chino Casual Half Pant,Amazon Essentials Men's Drawstring Walk Short,Levi's Men's Straight Chino Short Shorts,Rip Curl Men's Phase 21"",HELIKON-TEX CPU Men's Shorts Cotton Khaki,Rip Curl Men's RECLASSIFIED 20"" BOARDWAL,ProGo Men's Classic Fit Casual Fleece Jogger Gym Workout Short Pants with Elastic Waist,Rip Curl Men's Savage Walkshort,George Rose Print Black Woven Stretch Jogger Short,Wrangler,Rip Curl Men's Laze Volley,westAce Mens Stretch Chino Shorts Casual Flat Front Slim Fit Shorts Spandex Half Pant,EKLENTSON Men's Casual Twill Elastic Cargo Shorts Below Knee Loose Fit Multi-Pocket Capri Long Shorts,Uni Clau Mens Casual Shorts - Elastic Waist Summer Sports Jogger Shorts with Zipper Pockets,Mogogo Men's Hiphop Dance Classic-Fit Luxury Relaxed Casual Shorts,Wrangler Authentics Men's Big and Tall Classic Five-Pocket Jean Short,Kathmandu L-TRA Lightweight Quick Drying Travel Urban Outdoor Mens Shorts Men's,Tommy Hilfiger Men's Shorts,Island Style Clothing Mens Cotton Shorts Party Prints Hawaiian Style Casual Cruise,BohoHill Capri Thai Fisherman Pants Cropped Tribal Broken Rock Design,canterbury CCC Men's Tactic Shorts,Wrangler Men's Authentics,Amazon Essentials Men's Classic-Fit 7"" Plaid Short,Nautica Men's Classic Fit Flat Front Stretch Solid Chino Deck Short,Clothing for Plus Size Men Casual Loose Shorts (Color : Dark Gray, Size : L),Wrangler,Amazon Essentials Men's Classic-Fit 9"" Plaid Short,Kstare Classic Fit Perfect Short Athletic Pocket Sports Training Bodybuilding Summer Shorts Men's Workout Fitness Gym Pants,Goodthreads Amazon Brand Men's 9"" Inseam Hybrid Short,Krumba Men's Cotton Pigment Dyeing Outdoor Casual Cargo Shorts,Columbia Men's Silver Ridge Cargo Short, Fossil, 34x12,St. Goliath Men's Crypt Cargo Short,Champion Men's Warrior Short,QPNGRP Men's Casual Shorts Slim-Fit Chino Shorts for Men,PAUL JONES Men's Casual Classic Fit Jogging Gym Shorts,Wrangler Men's Big-Tall Authentics Premium Cargo Short,Lavnis Men's Casual Denim Shorts Classic Fit Distressed Summer Fashion Ripped Short Jeans,LEPTON 100% Mulberry Silk Shorts for Men, Relaxed Fitness Wear, Front Pockets, Elastic Waist,Wrangler Men's CIGI Short,Amazon Essentials Men's,Rip Curl Men's Mirage Owen Switch 18"" Shorts,Canterbury Vapodri Lightweight Stretch Short,Wrangler Men's Big and Tall Authentics Performance Side Elastic Utility Short,Wrangler Men's Authentics","24,30,20,16,27,26,37,79,56,63,33,69,22,38,49,31,47,29,33,38,149,44,34,38,44,33,28,64,44,37,27,51,34,54,14,49,33,15,35,51,49,54,34,22,36,39,33","3.7 out of 5 stars,2.9 out of 5 stars,4.1 out of 5 stars,4.2 out of 5 stars,4.3 out of 5 stars,5.0 out of 5 stars,5.0 out of 5 stars,4.5 out of 5 stars,5.0 out of 5 stars,4.6 out of 5 stars,3.0 out of 5 stars,4.1 out of 5 stars,4.2 out of 5 stars,4.5 out of 5 stars,5.0 out of 5 stars,4.6 out of 5 stars,4.4 out of 5 stars,4.4 out of 5 stars,4.4 out of 5 stars,4.3 out of 5 stars,3.6 out of 5 stars,4.4 out of 5 stars,3.8 out of 5 stars,4.4 out of 5 stars,4.5 out of 5 stars,3.8 out of 5 stars,4.4 out of 5 stars,4.4 out of 5 stars,4.0 out of 5 stars,3.6 out of 5 stars,4.5 out of 5 stars,4.0 out of 5 stars,4.5 out of 5 stars,4.5 out of 5 stars","67,3,515,41,1,567,1,1,814,1,489,2,116,342,114,3,1,325,87,170,57,1,448,7,25,16,21,2,415,2,884,17,14,96,10,162,1,686","https://m.media-amazon.com/images/I/61Ag6JK3uTL._AC_UL320_.jpg,https://m.media-amazon.com/images/I/61RHwa-oOfL._AC_UL320_.jpg,https://m.media-amazon.com/images/I/81+-uPZqzQL._AC_UL320_.jpg,https://m.media-amazon.com/images/I/71HiuaNP+bL._AC_UL320_.jpg,https://m.media-amazon.com/images/I/61mNryJiiFL._AC_UL320_.jpg,https://m.media-amazon.com/images/I/71x033MdR4L._AC_UL320_.jpg,https://m.media-amazon.com/images/I/71ucCCslHyL._AC_UL320_.jpg,https://m.media-amazon.com/images/I/61Rw0IiYmlL._AC_UL320_.jpg,https://m.media-amazon.com/images/I/61WVxvIfFIL._AC_UL320_.jpg,https://m.media-amazon.com/images/I/81hUO0MU7sL._AC_UL320_.jpg,https://m.media-amazon.com/images/I/81RfXqOWV+L._AC_UL320_.jpg,https://m.media-amazon.com/images/I/61Uvms0TLVL._AC_UL320_.jpg,https://m.media-amazon.com/images/I/71qZUYYwZvL._AC_UL320_.jpg,https://m.media-amazon.com/images/I/71TiqRuxQNL._AC_UL320_.jpg,https://m.media-amazon.com/images/I/51XbF9kRylL._AC_UL320_.jpg,https://m.media-amazon.com/images/I/51x7gMhl8CL._AC_UL320_.jpg,https://m.media-amazon.com/images/I/61zW0SwAJIL._AC_UL320_.jpg,https://m.media-amazon.com/images/I/51su2kheN5L._AC_UL320_.jpg,https://m.media-amazon.com/images/I/516px7IocKL._AC_UL320_.jpg,https://m.media-amazon.com/images/I/81JyFTFjtsL._AC_UL320_.jpg,https://m.media-amazon.com/images/I/91qg7n1m8lL._AC_UL320_.jpg,https://m.media-amazon.com/images/I/71tvlrGULnL._AC_UL320_.jpg,https://m.media-amazon.com/images/I/61HIykZ6jfL._AC_UL320_.jpg,https://m.media-amazon.com/images/I/71adgK8SFFL._AC_UL320_.jpg,https://m.media-amazon.com/images/I/81gpWwtXamL._AC_UL320_.jpg,https://m.media-amazon.com/images/I/91JIcLPviwL._AC_UL320_.jpg,https://m.media-amazon.com/images/I/81xKafnCevL._AC_UL320_.jpg,https://m.media-amazon.com/images/I/81qKMiZNe-L._AC_UL320_.jpg,https://m.media-amazon.com/images/I/41ybLskch+L._AC_UL320_.jpg,https://m.media-amazon.com/images/I/71YX0JXIOpL._AC_UL320_.jpg,https://m.media-amazon.com/images/I/810p3kNzFnL._AC_UL320_.jpg,https://m.media-amazon.com/images/I/61OOLzbaxKL._AC_UL320_.jpg,https://m.media-amazon.com/images/I/81nfTwT1A7L._AC_UL320_.jpg,https://m.media-amazon.com/images/I/71WpNS8AApL._AC_UL320_.jpg,https://m.media-amazon.com/images/I/51HtHydCWHL._AC_UL320_.jpg,https://m.media-amazon.com/images/I/716ADbPblhL._AC_UL320_.jpg,https://m.media-amazon.com/images/I/81IZLJ8eIGL._AC_UL320_.jpg,https://m.media-amazon.com/images/I/71ZvsU1heqL._AC_UL320_.jpg,https://m.media-amazon.com/images/I/81m+elNRO7L._AC_UL320_.jpg,https://m.media-amazon.com/images/I/81nTP-U5+-L._AC_UL320_.jpg,https://m.media-amazon.com/images/I/61xeyxbvSiL._AC_UL320_.jpg,https://m.media-amazon.com/images/I/61rUdueoQvL._AC_UL320_.jpg,https://m.media-amazon.com/images/I/71hDJtjv-jL._AC_UL320_.jpg,https://m.media-amazon.com/images/I/71ufgO6+qRL._AC_UL320_.jpg,https://m.media-amazon.com/images/I/71k2AhWsmuL._AC_UL320_.jpg,https://m.media-amazon.com/images/I/71gpLrne9TL._AC_UL320_.jpg,https://m.media-amazon.com/images/I/71z-vJO718L._AC_UL320_.jpg,https://m.media-amazon.com/images/I/81r0JLlPKAL._AC_UL320_.jpg"
